{
  "schema_version": "4.0.0",
  "event_id": "22222222-2222-4222-8222-222222222222",
  "run_id": "11111111-1111-4111-8111-111111111111",
  "sequence": 7,
  "event_type": "run_compensated",
  "occurred_at": "2026-07-12T12:00:00Z",
  "skill_name": "Contact Sync",
  "skill_version": "2.4.0",
  "action_id": null,
  "idempotency_key": null,
  "external_resource_id": null,
  "payload": {
    "reason": "all automatic compensations reached terminal success"
  }
}
